{
  "assessment_id": "AMI_ASSESS_20260217_fixture-excluded_v1",
  "system_id": "fixture-excluded",
  "version": 1,
  "assessed_at": "2026-02-17T12:00:00Z",
  "system_version": "2.0.0",
  "previous_assessment_id": null,
  "overall_score": null,
  "grade": null,
  "overall_confidence": "low",
  "status": "excluded",
  "category": "enterprise",
  "eligibility": {
    "agent_system": false,
    "public_artifact": true,
    "active_development": true,
    "maintainer_identifiable": true,
    "verified_sources_count": 0,
    "exclusion_flags": {
      "base_llm_only": true,
      "prompt_library_only": false,
      "research_prototype_only": false,
      "wrapper_only": false
    },
    "notes": "Excluded fixture — base LLM only, not an agent system."
  },
  "dimensions": [
    {
      "dimension_id": "execution_reliability",
      "dimension_name": "Execution Reliability",
      "score": null,
      "confidence": "unverified",
      "weight": 0.2,
      "rationale": "",
      "scored": false,
      "not_scored_reason": "Excluded — base LLM only",
      "evidence": []
    },
    {
      "dimension_id": "tooling_integration",
      "dimension_name": "Tooling & Integration Breadth",
      "score": null,
      "confidence": "unverified",
      "weight": 0.15,
      "rationale": "",
      "scored": false,
      "not_scored_reason": "Excluded — base LLM only",
      "evidence": []
    },
    {
      "dimension_id": "safety_guardrails",
      "dimension_name": "Safety & Guardrails",
      "score": null,
      "confidence": "unverified",
      "weight": 0.2,
      "rationale": "",
      "scored": false,
      "not_scored_reason": "Excluded — base LLM only",
      "evidence": []
    },
    {
      "dimension_id": "observability",
      "dimension_name": "Observability",
      "score": null,
      "confidence": "unverified",
      "weight": 0.15,
      "rationale": "",
      "scored": false,
      "not_scored_reason": "Excluded — base LLM only",
      "evidence": []
    },
    {
      "dimension_id": "deployment_maturity",
      "dimension_name": "Deployment Maturity",
      "score": null,
      "confidence": "unverified",
      "weight": 0.15,
      "rationale": "",
      "scored": false,
      "not_scored_reason": "Excluded — base LLM only",
      "evidence": []
    },
    {
      "dimension_id": "real_world_validation",
      "dimension_name": "Real-World Validation",
      "score": null,
      "confidence": "unverified",
      "weight": 0.15,
      "rationale": "",
      "scored": false,
      "not_scored_reason": "Excluded — base LLM only",
      "evidence": []
    }
  ],
  "methodology_version": "1.0",
  "assessed_by": "editorial-board",
  "notes": "Fixture: excluded status — base_llm_only exclusion flag set.",
  "review": {
    "state": "published",
    "reviewers": [
      {
        "name": "Editorial Board",
        "handle": "editorial-board",
        "signed_at": "2026-02-17T11:00:00Z",
        "signature_hash": "a7d5d66379e9131ff69d6ff8a3e98f57da88c01c0b0dfaa4cdd166e0fe65fea0"
      }
    ]
  },
  "integrity": {
    "assessment_hash": "2ecad4c30b79fc6541cf4211b55a7512e2fbffc9abe99809610c20bb833fb580",
    "hash_algorithm": "sha256",
    "hashed_at": "2026-02-17T10:07:48.877Z"
  }
}
