{
  "assessment_id": "AMI_ASSESS_20260217_fixture-insufficient_v1",
  "system_id": "fixture-insufficient",
  "version": 1,
  "assessed_at": "2026-02-17T12:00:00Z",
  "system_version": "0.3.0",
  "previous_assessment_id": null,
  "overall_score": null,
  "grade": null,
  "overall_confidence": "low",
  "status": "insufficient_evidence",
  "category": "cloud_workflow",
  "eligibility": {
    "agent_system": true,
    "public_artifact": true,
    "active_development": true,
    "maintainer_identifiable": true,
    "verified_sources_count": 1,
    "exclusion_flags": {
      "base_llm_only": false,
      "prompt_library_only": false,
      "research_prototype_only": false,
      "wrapper_only": false
    },
    "notes": "Insufficient evidence fixture — only 1 verified source available, cannot reach SCORED threshold."
  },
  "dimensions": [
    {
      "dimension_id": "execution_reliability",
      "dimension_name": "Execution Reliability",
      "score": null,
      "confidence": "unverified",
      "weight": 0.2,
      "rationale": "",
      "scored": false,
      "not_scored_reason": "Insufficient evidence to score",
      "evidence": []
    },
    {
      "dimension_id": "tooling_integration",
      "dimension_name": "Tooling & Integration Breadth",
      "score": null,
      "confidence": "unverified",
      "weight": 0.15,
      "rationale": "",
      "scored": false,
      "not_scored_reason": "Insufficient evidence to score",
      "evidence": []
    },
    {
      "dimension_id": "safety_guardrails",
      "dimension_name": "Safety & Guardrails",
      "score": null,
      "confidence": "unverified",
      "weight": 0.2,
      "rationale": "",
      "scored": false,
      "not_scored_reason": "Insufficient evidence to score",
      "evidence": []
    },
    {
      "dimension_id": "observability",
      "dimension_name": "Observability",
      "score": null,
      "confidence": "unverified",
      "weight": 0.15,
      "rationale": "",
      "scored": false,
      "not_scored_reason": "Insufficient evidence to score",
      "evidence": []
    },
    {
      "dimension_id": "deployment_maturity",
      "dimension_name": "Deployment Maturity",
      "score": null,
      "confidence": "unverified",
      "weight": 0.15,
      "rationale": "",
      "scored": false,
      "not_scored_reason": "Insufficient evidence to score",
      "evidence": []
    },
    {
      "dimension_id": "real_world_validation",
      "dimension_name": "Real-World Validation",
      "score": null,
      "confidence": "unverified",
      "weight": 0.15,
      "rationale": "",
      "scored": false,
      "not_scored_reason": "Insufficient evidence to score",
      "evidence": []
    }
  ],
  "methodology_version": "1.0",
  "assessed_by": "editorial-board",
  "notes": "Fixture: insufficient_evidence status — not enough verified sources to proceed to scoring.",
  "review": {
    "state": "reviewed",
    "reviewed_by": null,
    "reviewed_at": null
  },
  "integrity": {
    "assessment_hash": "5aba06f0424a91c1a9c556db769298a9df531c4adea7a22298d62956870bbfd6",
    "hash_algorithm": "sha256",
    "hashed_at": "2026-02-17T10:07:48.878Z"
  }
}
