{
  "assessment_id": "AMI_ASSESS_20260217_fixture-underreview_v1",
  "system_id": "fixture-underreview",
  "version": 1,
  "assessed_at": "2026-02-17T12:00:00Z",
  "system_version": "0.1.0",
  "previous_assessment_id": null,
  "overall_score": null,
  "grade": null,
  "overall_confidence": "low",
  "status": "under_review",
  "category": "cloud_autonomous",
  "eligibility": {
    "agent_system": true,
    "public_artifact": true,
    "active_development": true,
    "maintainer_identifiable": true,
    "verified_sources_count": 0,
    "exclusion_flags": {
      "base_llm_only": false,
      "prompt_library_only": false,
      "research_prototype_only": false,
      "wrapper_only": false
    },
    "notes": "Under review fixture â€” assessment not yet started."
  },
  "dimensions": [
    {
      "dimension_id": "execution_reliability",
      "dimension_name": "Execution Reliability",
      "score": null,
      "confidence": "unverified",
      "weight": 0.2,
      "rationale": "",
      "scored": false,
      "not_scored_reason": "Not yet assessed",
      "evidence": []
    },
    {
      "dimension_id": "tooling_integration",
      "dimension_name": "Tooling & Integration Breadth",
      "score": null,
      "confidence": "unverified",
      "weight": 0.15,
      "rationale": "",
      "scored": false,
      "not_scored_reason": "Not yet assessed",
      "evidence": []
    },
    {
      "dimension_id": "safety_guardrails",
      "dimension_name": "Safety & Guardrails",
      "score": null,
      "confidence": "unverified",
      "weight": 0.2,
      "rationale": "",
      "scored": false,
      "not_scored_reason": "Not yet assessed",
      "evidence": []
    },
    {
      "dimension_id": "observability",
      "dimension_name": "Observability",
      "score": null,
      "confidence": "unverified",
      "weight": 0.15,
      "rationale": "",
      "scored": false,
      "not_scored_reason": "Not yet assessed",
      "evidence": []
    },
    {
      "dimension_id": "deployment_maturity",
      "dimension_name": "Deployment Maturity",
      "score": null,
      "confidence": "unverified",
      "weight": 0.15,
      "rationale": "",
      "scored": false,
      "not_scored_reason": "Not yet assessed",
      "evidence": []
    },
    {
      "dimension_id": "real_world_validation",
      "dimension_name": "Real-World Validation",
      "score": null,
      "confidence": "unverified",
      "weight": 0.15,
      "rationale": "",
      "scored": false,
      "not_scored_reason": "Not yet assessed",
      "evidence": []
    }
  ],
  "methodology_version": "1.0",
  "assessed_by": "editorial-board",
  "notes": "Fixture: under_review status with all dimensions unscored.",
  "review": {
    "state": "draft",
    "reviewed_by": null,
    "reviewed_at": null
  },
  "integrity": {
    "assessment_hash": "f8f85fca03289d5a4683fe9c6d7a795073d5fc41d8b133d2c17f0c27ae32a00e",
    "hash_algorithm": "sha256",
    "hashed_at": "2026-02-17T10:07:48.877Z"
  }
}
