{
  "assessment_id": "AMI_ASSESS_20260217_fixture-inactive_v1",
  "system_id": "fixture-inactive",
  "version": 1,
  "assessed_at": "2026-02-17T12:00:00Z",
  "system_version": "1.2.0",
  "previous_assessment_id": null,
  "overall_score": null,
  "grade": null,
  "overall_confidence": "low",
  "status": "inactive",
  "category": "local_autonomous",
  "eligibility": {
    "agent_system": true,
    "public_artifact": true,
    "active_development": false,
    "maintainer_identifiable": true,
    "verified_sources_count": 2,
    "exclusion_flags": {
      "base_llm_only": false,
      "prompt_library_only": false,
      "research_prototype_only": false,
      "wrapper_only": false
    },
    "notes": "Inactive fixture — project no longer actively maintained."
  },
  "dimensions": [
    {
      "dimension_id": "execution_reliability",
      "dimension_name": "Execution Reliability",
      "score": null,
      "confidence": "unverified",
      "weight": 0.2,
      "rationale": "",
      "scored": false,
      "not_scored_reason": "Project inactive — scoring suspended",
      "evidence": []
    },
    {
      "dimension_id": "tooling_integration",
      "dimension_name": "Tooling & Integration Breadth",
      "score": null,
      "confidence": "unverified",
      "weight": 0.15,
      "rationale": "",
      "scored": false,
      "not_scored_reason": "Project inactive — scoring suspended",
      "evidence": []
    },
    {
      "dimension_id": "safety_guardrails",
      "dimension_name": "Safety & Guardrails",
      "score": null,
      "confidence": "unverified",
      "weight": 0.2,
      "rationale": "",
      "scored": false,
      "not_scored_reason": "Project inactive — scoring suspended",
      "evidence": []
    },
    {
      "dimension_id": "observability",
      "dimension_name": "Observability",
      "score": null,
      "confidence": "unverified",
      "weight": 0.15,
      "rationale": "",
      "scored": false,
      "not_scored_reason": "Project inactive — scoring suspended",
      "evidence": []
    },
    {
      "dimension_id": "deployment_maturity",
      "dimension_name": "Deployment Maturity",
      "score": null,
      "confidence": "unverified",
      "weight": 0.15,
      "rationale": "",
      "scored": false,
      "not_scored_reason": "Project inactive — scoring suspended",
      "evidence": []
    },
    {
      "dimension_id": "real_world_validation",
      "dimension_name": "Real-World Validation",
      "score": null,
      "confidence": "unverified",
      "weight": 0.15,
      "rationale": "",
      "scored": false,
      "not_scored_reason": "Project inactive — scoring suspended",
      "evidence": []
    }
  ],
  "methodology_version": "1.0",
  "assessed_by": "editorial-board",
  "notes": "Fixture: inactive status — active_development is false.",
  "review": {
    "state": "published",
    "reviewers": [
      {
        "name": "Editorial Board",
        "handle": "editorial-board",
        "signed_at": "2026-02-17T11:00:00Z",
        "signature_hash": "8444635c23d281e3ae00cba7671edf0bd85e9b8826306dd4b761fee7308335ff"
      }
    ]
  },
  "integrity": {
    "assessment_hash": "7c55ce96f6db72b3c1cdc3513fb81c619aca0564d84f73dd9cf127a56f38e203",
    "hash_algorithm": "sha256",
    "hashed_at": "2026-02-17T10:07:48.875Z"
  }
}
